age,fnlwgt,capital-gain,capital-loss,hours-per-week,education-num,workclass,education,marital-status,occupation,relationship,race,sex,native-country,class
0.03904451,217.71783,5.621231,1399.2870205607,0.50684,16.18908, Federal-gov, 5th-6th, Married-spouse-absent, Armed-Forces, Unmarried, White, Male, Poland,50K-
28.7436117,13728.5269,16531.801677,1466.696050263,11.73937,10.78121, Private, Assoc-acdm, Widowed, Priv-house-serv, Husband, Asian-Pac-Islander, Female, Haiti,50K-
66.33201506,306445.64423,5471.521774,1551.7315733669,47.57533,10.65931, Local-gov, 1st-4th, Married-AF-spouse, Machine-op-inspct, Other-relative, Amer-Indian-Eskimo, Female, South,50K-
58.70943763,201281.49994,12278.108548,569.7566085402,62.82358,6.05273, Local-gov, 1st-4th, Widowed, Transport-moving, Other-relative, Amer-Indian-Eskimo, Male, Mexico,50K-
17.5288552,513782.54318,17937.512524,62.9414514578,80.62558,11.54036, Never-worked, Some-college, Divorced, Other-service, Wife, Other, Male, Puerto-Rico,50K-
51.55349706,486420.33084,9463.977735,1504.9000534353,55.75923,14.8825, ?, 1st-4th, Married-AF-spouse, Transport-moving, Wife, Black, Male, Haiti,50K-
11.44278604,398855.87336,23617.192512,407.4949354254,39.14863,3.9537, Never-worked, 10th, Married-AF-spouse, ?, Own-child, Asian-Pac-Islander, Female, Jamaica,50K-
0.52216248,217.71783,2393.750634,1242.0976762668,15.81935,14.22815, Self-emp-inc, Prof-school, Widowed, Tech-support, Unmarried, Other, Male, Yugoslavia,50K-
28.32584705,162590.73678,5.621231,1025.9152480257,26.58682,7.5344, State-gov, Some-college, Married-spouse-absent, Exec-managerial, Own-child, Black, Male, Italy,50K-
51.07878822,23723.23971,13714.451678,771.7323876348,62.70475,7.41461, ?, 12th, Divorced, Farming-fishing, Own-child, Asian-Pac-Islander, Female, Nicaragua,50K-
2.54554275,217.71783,5.621231,450.5174377663,47.00175,7.59766, State-gov, Bachelors, Married-AF-spouse, Transport-moving, Wife, White, Male, Yugoslavia,50K-
47.17681712,151333.01349,3181.298773,995.3572262684,60.20465,10.55105, Self-emp-not-inc, 12th, Separated, Armed-Forces, Own-child, Asian-Pac-Islander, Female, Scotland,50K-
7.4448757,475753.18574,1170.051765,304.4136332271,63.7092,9.79475, Private, Doctorate, Married-spouse-absent, Craft-repair, Own-child, White, Male, South,50K-
50.27913066,26871.66317,10914.607617,799.2783123289,12.68048,5.5405, Without-pay, 12th, Widowed, Protective-serv, Wife, White, Male, Italy,50K-
57.41756499,55307.72165,1043.441345,43.2828797849,18.93878,6.1238, Never-worked, HS-grad, Never-married, Farming-fishing, Wife, White, Female, Jamaica,50K-
80.73255183,147350.106,15322.001985,140.907292838,8.70805,10.32786, Private, 5th-6th, Married-civ-spouse, Adm-clerical, Own-child, Black, Male, India,50K-
22.73597342,234557.99431,13816.881123,794.5654903396,53.18122,10.12656, Federal-gov, 11th, Divorced, ?, Husband, Other, Male, Puerto-Rico,50K-
46.60997369,276038.1713,9239.585409,947.7819288147,1.9928,11.45905, Self-emp-inc, 9th, Never-married, Other-service, Own-child, Amer-Indian-Eskimo, Female, Puerto-Rico,50K-
15.72065662,159944.3734,5.621231,1036.0114449294,19.70828,10.88441, Federal-gov, 1st-4th, Married-civ-spouse, Exec-managerial, Wife, Amer-Indian-Eskimo, Female, Laos,50K-
14.50907472,238567.02949,11383.320666,858.0555278227,34.69252,12.95602, State-gov, 12th, Separated, Priv-house-serv, Own-child, Other, Female, Puerto-Rico,50K-
58.45441983,34386.62393,18314.578723,1000.7505314245,42.30126,0.38529, Federal-gov, 1st-4th, Widowed, Armed-Forces, Husband, Black, Male, Hong,50K-
21.63539697,35001.69648,17180.731853,0.0054957275,7.73489,8.47168, Self-emp-not-inc, Bachelors, Married-civ-spouse, Sales, Not-in-family, White, Female, Portugal,50K-
21.08614639,457568.95635,7588.210727,467.1420877256,49.8858,4.70928, Self-emp-not-inc, 11th, Widowed, Exec-managerial, Other-relative, White, Female, Germany,50K-
46.81176762,53908.64872,314.708108,806.7534284091,38.90377,7.75037, Self-emp-not-inc, 5th-6th, Divorced, Adm-clerical, Own-child, Other, Female, Italy,50K-
15.60657886,217.71783,5.621231,671.7242530911,0.50684,13.92764, State-gov, Some-college, Married-AF-spouse, Protective-serv, Unmarried, Other, Female, Cuba,50K-
4.10096387,331356.00065,10092.622145,85.9159475825,0.50684,6.17572, Never-worked, 11th, Never-married, Prof-specialty, Other-relative, White, Female, Italy,50K-
10.44381003,405092.89654,8035.3642,1079.2071757136,41.63578,5.6149, Never-worked, 5th-6th, Never-married, Farming-fishing, Unmarried, White, Female, Dominican-Republic,50K-
35.13791185,380419.72527,16631.917766,1033.3651220731,53.4934,11.01534, Local-gov, 7th-8th, Married-spouse-absent, Armed-Forces, Other-relative, Amer-Indian-Eskimo, Male, Laos,50K-
72.95555666,494221.43493,17388.870202,1155.8982457801,41.10117,13.03646, Federal-gov, 11th, Married-AF-spouse, Transport-moving, Husband, Other, Male, Thailand,50K-
58.92535172,134749.6187,15215.758587,557.9332579847,28.58484,6.34964, Without-pay, Bachelors, Divorced, Handlers-cleaners, Unmarried, Amer-Indian-Eskimo, Male, China,50K-
7.41574995,217.71783,25874.067236,0.0054957275,0.50684,11.52623, State-gov, 10th, Separated, Adm-clerical, Unmarried, Asian-Pac-Islander, Male, United-States,50K-
81.37349528,94621.5712,17734.225958,105.9612402512,33.80774,6.75752, Private, Assoc-voc, Never-married, Protective-serv, Unmarried, Asian-Pac-Islander, Male, United-States,50K-
27.50984105,13237.42102,5.621231,0.0054957275,5.92342,12.0032, Without-pay, Masters, Widowed, Craft-repair, Own-child, Asian-Pac-Islander, Female, Guatemala,50K-
14.99006262,304583.07117,28040.754661,1545.2485874348,68.32224,9.78876, State-gov, 11th, Never-married, Craft-repair, Own-child, Amer-Indian-Eskimo, Female, England,50K-
0.03904451,217.71783,5.621231,0.0054957275,0.50684,0.21031, Never-worked, Prof-school, Widowed, Sales, Not-in-family, Asian-Pac-Islander, Male, India,50K-
21.47549868,122231.82984,9592.374953,601.6672051467,83.00972,10.76636, Local-gov, Assoc-voc, Married-spouse-absent, ?, Other-relative, White, Male, Guatemala,50K-
16.30560156,217.71783,5.621231,338.2762220293,40.69852,9.68083, Local-gov, 9th, Married-AF-spouse, Transport-moving, Own-child, Amer-Indian-Eskimo, Male, Ireland,50K-
10.909394,365056.31211,11648.77039,1213.8685041475,35.16247,9.17834, Private, 10th, Separated, Transport-moving, Not-in-family, Other, Male, ?,50K-
6.89403232,4932.39439,6046.040026,0.0054957275,81.75976,8.98535, Without-pay, Assoc-voc, Married-civ-spouse, Sales, Husband, White, Female, Yugoslavia,50K-
31.28463142,540623.13441,24424.623069,81.7568767341,75.78336,11.10244, Private, 9th, Widowed, Handlers-cleaners, Own-child, White, Female, Canada,50K-
23.12990635,128953.99143,8286.532642,527.3593348826,17.9179,7.5948, ?, 12th, Separated, Priv-house-serv, Not-in-family, Asian-Pac-Islander, Female, Honduras,50K-
61.48764273,496423.75421,5276.55415,578.0012949064,41.43103,9.87497, Federal-gov, HS-grad, Never-married, Transport-moving, Not-in-family, Amer-Indian-Eskimo, Female, Outlying-US(Guam-USVI-etc),50K-
10.93811887,287046.52833,5.621231,0.0054957275,0.50684,4.30331, ?, 1st-4th, Widowed, Adm-clerical, Other-relative, Black, Female, Thailand,50K-
0.03904451,217.71783,3785.503367,64.3436144172,54.41392,14.06143, Self-emp-not-inc, Assoc-acdm, Divorced, Tech-support, Unmarried, Amer-Indian-Eskimo, Male, Honduras,50K-
30.24958643,53495.22834,10845.037764,1111.0960166765,33.11797,11.99799, Self-emp-inc, Assoc-voc, Widowed, Armed-Forces, Not-in-family, Black, Female, Columbia,50K-
67.85112215,332798.15089,1842.535621,1006.6182898524,21.79697,17.01319, Self-emp-inc, 1st-4th, Divorced, Craft-repair, Husband, Asian-Pac-Islander, Male, Cuba,50K-
13.48663925,387717.83009,5.621231,1369.8000489973,78.72534,11.60283, State-gov, Preschool, Separated, ?, Unmarried, Asian-Pac-Islander, Female, Laos,50K-
0.03904451,217.71783,5.621231,0.0054957275,0.50684,10.1333, ?, 7th-8th, Never-married, Tech-support, Not-in-family, Black, Male, Canada,50K-
65.82045206,428350.00276,8480.5969,567.4922513894,40.32034,4.90167, Local-gov, 9th, Married-civ-spouse, Transport-moving, Own-child, White, Male, Columbia,50K-
42.9616316,520641.11879,7106.311493,447.9268310152,29.64263,12.30269, State-gov, 11th, Separated, Other-service, Unmarried, Amer-Indian-Eskimo, Female, Haiti,50K-
1.30071328,387972.80831,5.621231,1275.9715959588,41.45618,4.18215, Local-gov, Masters, Married-civ-spouse, Handlers-cleaners, Unmarried, Other, Male, Ecuador,50K-
75.21766556,152275.39856,8973.558954,791.8808759731,0.82585,14.9594, Federal-gov, 5th-6th, Married-spouse-absent, Machine-op-inspct, Unmarried, White, Male, Cuba,50K-
66.68729035,410360.49575,15797.540279,951.8816407873,42.70179,1.628, Private, Some-college, Divorced, Prof-specialty, Unmarried, Amer-Indian-Eskimo, Male, Haiti,50K+
66.75579204,217777.30037,22400.04437,1085.766548858,37.97051,18.18169, Never-worked, Some-college, Married-civ-spouse, Handlers-cleaners, Unmarried, Asian-Pac-Islander, Male, Trinadad&Tobago,50K+
35.48302507,457611.64584,10140.714485,1012.6366446998,27.87853,11.77292, Federal-gov, Assoc-acdm, Divorced, Priv-house-serv, Wife, Black, Male, Scotland,50K+
39.48911506,440369.68241,25268.828596,477.0987296609,13.67519,14.2304, Private, 12th, Widowed, Transport-moving, Husband, White, Female, Greece,50K+
22.63654472,350076.71516,10956.745403,1295.8308193121,63.84798,10.57717, Local-gov, 9th, Married-AF-spouse, Adm-clerical, Not-in-family, Other, Male, Peru,50K+
21.56448607,144450.49908,5.621231,0.0054957275,66.2157,7.67237, Never-worked, Assoc-acdm, Married-civ-spouse, Tech-support, Wife, White, Female, Hong,50K+
67.93124531,270204.94063,19070.435227,0.0054957275,61.19034,8.92412, ?, Prof-school, Widowed, Exec-managerial, Wife, White, Male, Thailand,50K+
0.03904451,217.71783,29002.140915,364.7304430794,43.76682,0.21031, State-gov, Some-college, Never-married, Sales, Husband, Asian-Pac-Islander, Male, China,50K+
51.47030553,511497.1416,27859.977896,948.1235105951,48.68846,8.04662, Without-pay, Assoc-voc, Separated, Tech-support, Own-child, Other, Male, Portugal,50K+
53.22754797,493369.59578,19414.087114,1051.0792627882,26.23828,15.84064, Self-emp-not-inc, 11th, Separated, Armed-Forces, Not-in-family, Asian-Pac-Islander, Male, Cambodia,50K+
62.72509827,258201.59399,11980.761536,1231.6539384492,76.27509,9.95984, Without-pay, Some-college, Married-civ-spouse, Farming-fishing, Other-relative, Black, Male, Germany,50K+
56.90897956,24644.03673,454.654417,154.3817987337,35.37491,4.70454, Local-gov, Assoc-voc, Widowed, Sales, Wife, Amer-Indian-Eskimo, Male, Taiwan,50K+
26.98570078,258481.75391,23356.228815,259.6322007399,24.94253,8.06839, Never-worked, Prof-school, Never-married, Transport-moving, Husband, Amer-Indian-Eskimo, Female, India,50K+
41.6649778,352793.72574,19221.462151,524.1525154904,85.78964,10.57096, Self-emp-not-inc, 9th, Never-married, ?, Husband, Asian-Pac-Islander, Female, Cuba,50K+
74.56868169,116875.46958,11765.067389,618.0275139847,3.53652,6.42328, Private, Preschool, Divorced, Sales, Not-in-family, White, Female, ?,50K+
41.66560663,217.71783,16723.710396,890.7278869691,8.95849,11.93879, Private, 5th-6th, Married-AF-spouse, Craft-repair, Unmarried, Other, Female, England,50K+
2.93602917,97764.31944,25463.223899,181.7679507491,73.18791,12.34693, Without-pay, 7th-8th, Widowed, Machine-op-inspct, Other-relative, Asian-Pac-Islander, Female, Ecuador,50K+
34.00778418,217.71783,11028.59882,310.4756367905,0.50684,5.34368, Self-emp-inc, Bachelors, Married-civ-spouse, Protective-serv, Wife, White, Male, Scotland,50K+
33.03297415,199154.23321,21826.83883,1354.6607015348,67.3969,11.41435, ?, 11th, Never-married, Priv-house-serv, Husband, Asian-Pac-Islander, Female, Trinadad&Tobago,50K+
55.23367468,385451.8297,25847.867697,1438.1636789311,87.17195,15.43687, Private, Bachelors, Married-civ-spouse, Other-service, Wife, Asian-Pac-Islander, Male, Yugoslavia,50K+
56.30869893,358677.61732,26138.366427,763.5630431251,36.42682,14.05417, Federal-gov, 5th-6th, Divorced, Handlers-cleaners, Wife, White, Female, Haiti,50K+
8.87650534,138824.74076,22260.17465,680.5480622071,65.57111,14.14409, Local-gov, 7th-8th, Married-AF-spouse, Prof-specialty, Wife, Amer-Indian-Eskimo, Female, Guatemala,50K+
66.7569074,30935.96295,22004.602539,651.8887360763,74.34219,13.56793, Federal-gov, HS-grad, Never-married, Craft-repair, Other-relative, Asian-Pac-Islander, Male, Ireland,50K+
31.11485388,383601.49517,25980.701675,748.6891785257,8.10786,9.78241, Federal-gov, 9th, Married-AF-spouse, Adm-clerical, Other-relative, Black, Male, Greece,50K+
26.50238711,240782.13177,10038.269213,869.8730392275,70.42599,8.97916, Never-worked, Doctorate, Married-AF-spouse, Machine-op-inspct, Other-relative, Other, Male, Scotland,50K+
46.75680329,178746.0349,27023.252196,1050.9851020109,81.66054,4.24879, Local-gov, Assoc-voc, Separated, Protective-serv, Not-in-family, White, Female, Outlying-US(Guam-USVI-etc),50K+
35.12096554,328995.38374,13311.98094,1348.9290657017,43.74138,7.627, Without-pay, 1st-4th, Divorced, Priv-house-serv, Wife, Asian-Pac-Islander, Male, Cuba,50K+
57.43353178,129237.49932,26943.099857,1558.409203623,52.75286,17.01192, Local-gov, 1st-4th, Divorced, Exec-managerial, Wife, Black, Male, United-States,50K+
22.72491061,72587.37207,18461.79321,1551.6378056271,59.37586,6.45276, Self-emp-inc, 10th, Divorced, Sales, Unmarried, Amer-Indian-Eskimo, Male, South,50K+
81.33169528,299273.21554,16770.511447,1546.7596751034,27.04742,4.00258, Without-pay, Prof-school, Divorced, Armed-Forces, Not-in-family, Other, Female, Nicaragua,50K+
15.93840944,217.71783,8783.756425,994.8962938966,76.53933,10.79835, Self-emp-not-inc, Bachelors, Married-civ-spouse, Prof-specialty, Wife, Other, Male, El-Salvador,50K+
0.03904451,217.71783,23990.252019,1255.2744850806,53.66809,9.96551, Federal-gov, 11th, Married-AF-spouse, Prof-specialty, Not-in-family, White, Male, Dominican-Republic,50K+
73.11574331,223627.517,25522.124309,408.2246684537,55.15791,13.04015, Private, Masters, Widowed, Other-service, Not-in-family, Black, Male, Japan,50K+
12.44197282,308466.19787,26592.004686,1077.2660327869,48.87569,5.97665, Federal-gov, Assoc-voc, Married-civ-spouse, Exec-managerial, Wife, Amer-Indian-Eskimo, Female, Iran,50K+
23.90614861,421768.70564,24912.688581,0.0054957275,67.74965,4.27736, Never-worked, Doctorate, Widowed, Handlers-cleaners, Other-relative, Black, Female, Ireland,50K+
28.11459996,10786.92997,28245.969433,270.6831464268,8.14999,15.74279, State-gov, Prof-school, Married-civ-spouse, Priv-house-serv, Husband, White, Male, Philippines,50K+
25.48838361,427163.72796,16509.607979,976.9105932547,17.49849,12.77918, Federal-gov, 11th, Separated, Tech-support, Unmarried, Black, Female, China,50K+
0.03904451,6452.48461,24160.304298,423.718445387,23.69494,9.04801, Local-gov, HS-grad, Never-married, Craft-repair, Other-relative, Asian-Pac-Islander, Male, Philippines,50K+
51.67985365,442953.60808,28804.009325,142.9728266797,28.5548,11.50011, Private, 7th-8th, Separated, Other-service, Own-child, Asian-Pac-Islander, Male, Scotland,50K+
80.99408128,262898.88714,28408.533233,897.0744605488,68.29164,8.7865, Self-emp-not-inc, Some-college, Widowed, ?, Other-relative, Other, Male, France,50K+
19.06194709,88309.57652,28083.60612,1045.5514431759,34.39316,12.81927, Federal-gov, 7th-8th, Divorced, Sales, Own-child, Asian-Pac-Islander, Male, Nicaragua,50K+
44.14879735,368894.07819,29284.223813,1270.6542398434,47.11013,12.63268, ?, Bachelors, Married-civ-spouse, Tech-support, Unmarried, White, Male, Hong,50K+
15.6013502,201650.54051,8080.653494,1251.4936799623,36.07692,10.953, Never-worked, Doctorate, Married-AF-spouse, Adm-clerical, Other-relative, Asian-Pac-Islander, Male, Poland,50K+
83.01648361,386808.02811,21211.471139,1251.7828496694,57.02327,2.50616, Federal-gov, Assoc-voc, Never-married, Prof-specialty, Other-relative, White, Male, Peru,50K+
46.99293327,134305.69281,24521.594989,64.7255319025,19.80681,4.1623, Local-gov, Some-college, Married-civ-spouse, Sales, Own-child, Other, Female, Outlying-US(Guam-USVI-etc),50K+
25.57685593,360558.41182,14923.669289,158.7035853504,73.41385,10.16296, Private, Doctorate, Married-AF-spouse, Priv-house-serv, Not-in-family, White, Female, Columbia,50K+
61.30424686,98696.48941,8356.394329,530.0332061028,39.86571,14.91054, Local-gov, Assoc-acdm, Married-civ-spouse, ?, Own-child, White, Female, Peru,50K+
73.43898947,336435.90707,16474.835031,948.1612827265,48.14232,9.28122, ?, Some-college, Married-civ-spouse, Farming-fishing, Unmarried, White, Male, El-Salvador,50K+
53.75894181,217.71783,5.621231,948.7293459884,19.92432,11.44226, Self-emp-not-inc, Prof-school, Married-spouse-absent, Other-service, Wife, Asian-Pac-Islander, Male, Jamaica,50K+
71.38057753,169422.94632,25985.7006,8.3126350772,61.56032,11.66737, Never-worked, 9th, Married-civ-spouse, ?, Wife, White, Female, ?,50K+
13.84100275,217.71783,15831.523249,0.0054957275,51.82441,10.24512, Self-emp-not-inc, Masters, Married-AF-spouse, Priv-house-serv, Wife, White, Female, Jamaica,50K+
46.98104748,294635.15324,17559.872292,408.4641888498,0.50684,3.75064, Federal-gov, 10th, Married-AF-spouse, Tech-support, Unmarried, White, Male, Yugoslavia,50K+
82.59321232,356986.28838,29193.304978,1334.141137808,17.36086,8.40357, Private, 11th, Married-civ-spouse, Tech-support, Own-child, Amer-Indian-Eskimo, Male, Philippines,50K+
38.50285523,90724.04923,12371.397076,0.0054957275,61.75356,10.85247, Never-worked, Masters, Divorced, Protective-serv, Not-in-family, Asian-Pac-Islander, Male, Thailand,50K+
33.9943058,78622.53221,21830.854211,901.0599373852,32.06973,10.98664, Never-worked, Prof-school, Married-AF-spouse, ?, Husband, White, Male, South,50K+
77.48206167,312736.45191,18648.419603,374.0955792348,12.02964,12.52417, Self-emp-not-inc, 5th-6th, Married-civ-spouse, Exec-managerial, Wife, Other, Female, Haiti,50K+
17.36925684,283325.52803,5.621231,500.9714202396,57.17296,7.9829, Local-gov, Assoc-acdm, Married-AF-spouse, Adm-clerical, Husband, Other, Male, France,50K+
0.03904451,217.71783,28791.098135,0.0054957275,23.0648,0.21031, State-gov, 1st-4th, Married-civ-spouse, Exec-managerial, Husband, Asian-Pac-Islander, Male, Nicaragua,50K+
63.29084441,210594.73844,17839.497921,849.7867633878,47.8717,9.49905, Never-worked, Bachelors, Widowed, Exec-managerial, Husband, Black, Male, Outlying-US(Guam-USVI-etc),50K+
72.45992966,451682.62646,2706.11811,1107.4654748785,33.07828,12.48965, State-gov, 10th, Separated, Prof-specialty, Not-in-family, White, Male, Germany,50K+
0.03904451,217.71783,24699.545898,0.0054957275,45.35321,6.53455, Private, Bachelors, Never-married, Sales, Unmarried, Other, Female, Portugal,50K+
68.0322989,510590.82328,4939.817206,398.8910551603,31.65393,11.91663, Private, Prof-school, Married-AF-spouse, Prof-specialty, Other-relative, Black, Female, Dominican-Republic,50K+
80.30615912,157387.31752,18726.407448,175.2807848496,32.49318,4.18072, Federal-gov, HS-grad, Widowed, Armed-Forces, Wife, White, Male, Iran,50K+
2.21564369,84191.93673,14943.223858,1476.7847185365,19.29805,11.47981, Federal-gov, Some-college, Married-civ-spouse, Armed-Forces, Unmarried, Black, Female, Scotland,50K+
75.71904565,93849.13661,28098.896181,1076.3554644633,64.3921,8.69768, Local-gov, 10th, Married-civ-spouse, Exec-managerial, Wife, Other, Female, Vietnam,50K+
56.06632201,53567.38473,14697.416875,870.082094909,80.54744,8.71152, Local-gov, 5th-6th, Married-AF-spouse, Craft-repair, Other-relative, White, Female, Peru,50K+
82.89241366,144559.46361,14923.988718,1466.2732806388,80.64063,5.78656, Federal-gov, Assoc-voc, Married-spouse-absent, ?, Wife, Amer-Indian-Eskimo, Male, Japan,50K+
77.74865028,295125.25033,14656.267992,583.9731774094,37.4064,10.94928, ?, 5th-6th, Separated, Transport-moving, Husband, Amer-Indian-Eskimo, Female, Ecuador,50K+
37.77309183,113916.72514,21946.732096,238.5210918976,62.69912,11.31513, Federal-gov, Bachelors, Married-civ-spouse, Transport-moving, Own-child, Other, Female, China,50K+
65.07451993,424108.38253,1773.686261,1011.4809672448,66.47357,12.7072, Without-pay, Masters, Married-civ-spouse, Priv-house-serv, Own-child, Black, Female, Cambodia,50K+
0.03904451,217.71783,27353.334742,853.6718872916,0.50684,17.07044, Self-emp-not-inc, Assoc-acdm, Divorced, Adm-clerical, Unmarried, Amer-Indian-Eskimo, Male, Dominican-Republic,50K+
66.12816196,455875.13542,29522.213495,308.3219286532,85.49889,11.39258, State-gov, 5th-6th, Widowed, Adm-clerical, Other-relative, White, Male, Philippines,50K+
0.03904451,54959.36213,24934.043815,0.0054957275,0.50684,13.22604, Local-gov, 11th, Separated, Tech-support, Not-in-family, Black, Female, Haiti,50K+
79.11643615,345830.3742,13710.817429,427.2648866704,5.73735,15.45223, ?, Some-college, Separated, Protective-serv, Husband, White, Female, Ireland,50K+
32.91223075,217.71783,22843.227985,628.9140765012,0.50684,12.86558, Federal-gov, Some-college, Married-spouse-absent, Craft-repair, Other-relative, Asian-Pac-Islander, Female, Peru,50K+
62.8723594,430874.88969,22093.056825,1015.7735919536,45.78172,12.55756, Self-emp-inc, 12th, Married-civ-spouse, Exec-managerial, Not-in-family, White, Male, Ireland,50K+
48.02047346,4206.38676,23207.774424,1260.790678936,47.91514,4.75498, Never-worked, 11th, Married-civ-spouse, Machine-op-inspct, Unmarried, White, Female, Guatemala,50K+
47.42406225,542046.27952,5801.739084,742.159268778,8.48472,8.90602, State-gov, Some-college, Divorced, Tech-support, Not-in-family, Other, Male, Outlying-US(Guam-USVI-etc),50K+
40.75117409,250832.48359,21554.760128,1411.2342869961,21.84512,11.90016, Self-emp-not-inc, Prof-school, Married-spouse-absent, Prof-specialty, Other-relative, White, Female, Mexico,50K+
0.03904451,217.71783,29040.294612,1404.4187756002,82.73698,0.21031, Never-worked, Masters, Divorced, Handlers-cleaners, Husband, Amer-Indian-Eskimo, Male, Guatemala,50K+
32.43406801,441750.3739,22219.853331,0.0054957275,68.98572,17.36321, Local-gov, Masters, Widowed, Farming-fishing, Not-in-family, White, Female, Thailand,50K+
30.96459887,520703.60782,29535.003387,452.1145162788,72.90175,0.21031, ?, Doctorate, Married-spouse-absent, Armed-Forces, Husband, Asian-Pac-Islander, Male, Taiwan,50K+
36.93158806,217.71783,23412.747938,1150.7335875393,84.67953,6.14388, ?, Bachelors, Divorced, Tech-support, Other-relative, Asian-Pac-Islander, Male, Cuba,50K+
65.47847341,135729.99966,19591.360091,128.8799082778,68.82055,12.59644, Never-worked, 7th-8th, Married-civ-spouse, Other-service, Unmarried, Other, Female, Japan,50K+
37.01313913,542076.1548,27418.469223,1529.463560153,31.40667,13.22347, Without-pay, 5th-6th, Married-civ-spouse, Sales, Husband, Black, Female, Yugoslavia,50K+
26.40571064,14406.55219,10672.378748,117.5177950964,34.1141,7.75634, Without-pay, Prof-school, Married-civ-spouse, Priv-house-serv, Husband, Black, Male, Haiti,50K+
29.82823942,454983.43198,27763.980262,1429.4953426844,42.18196,10.50572, Self-emp-not-inc, 1st-4th, Married-civ-spouse, Prof-specialty, Own-child, Other, Male, Peru,50K+
79.633287,417000.1806,12363.819561,779.9824023836,78.79158,4.89962, ?, 1st-4th, Married-civ-spouse, Armed-Forces, Husband, Other, Female, Laos,50K+
0.03904451,429250.15268,26766.685989,1140.5945560329,0.50684,9.74966, Self-emp-not-inc, 5th-6th, Widowed, Tech-support, Unmarried, Amer-Indian-Eskimo, Male, Columbia,50K+
0.03904451,547550.71415,25411.446646,1191.8735093996,56.51395,8.68862, Local-gov, Bachelors, Never-married, Tech-support, Wife, White, Male, Scotland,50K+
36.41559903,468068.75867,2527.944035,1221.4188641514,77.45691,8.48878, Self-emp-inc, Doctorate, Separated, Exec-managerial, Own-child, White, Male, Trinadad&Tobago,50K+
44.9420617,485750.35919,24004.788139,789.8951903239,89.00905,7.06194, Federal-gov, 10th, Never-married, Priv-house-serv, Husband, Other, Female, Trinadad&Tobago,50K+
0.03904451,465209.17759,25848.121045,0.0054957275,15.00147,14.34292, State-gov, 5th-6th, Married-spouse-absent, Craft-repair, Wife, Black, Female, India,50K+
0.03904451,217.71783,23458.617499,0.0054957275,21.33863,8.11915, Local-gov, Some-college, Married-civ-spouse, Machine-op-inspct, Not-in-family, Asian-Pac-Islander, Male, Greece,50K+
45.83842399,499395.53503,16795.965506,850.4788921045,35.44744,6.68689, ?, 7th-8th, Divorced, Machine-op-inspct, Wife, White, Female, Scotland,50K+
37.42221439,38782.46091,20776.041314,1485.1439225124,22.5152,11.45396, Local-gov, Preschool, Separated, Handlers-cleaners, Not-in-family, Black, Male, Iran,50K+
58.29555595,38567.40363,2824.919054,396.7884097472,65.59096,16.85135, Local-gov, Masters, Never-married, Exec-managerial, Wife, Black, Male, France,50K+
52.11328792,105331.14487,5433.871355,809.2569846609,79.59634,12.81928, Private, 11th, Married-civ-spouse, Tech-support, Other-relative, Asian-Pac-Islander, Female, Greece,50K+
33.86359678,484640.94526,11505.655498,0.0054957275,30.99375,12.73879, Without-pay, Assoc-voc, Married-civ-spouse, Machine-op-inspct, Not-in-family, Asian-Pac-Islander, Female, Outlying-US(Guam-USVI-etc),50K+
69.15447685,14338.91366,9042.090294,1330.1541420051,57.34059,17.31958, Self-emp-inc, Doctorate, Separated, Transport-moving, Not-in-family, Black, Male, El-Salvador,50K+
66.0333002,310156.20864,28712.279662,1270.0099867675,8.1485,11.26591, Without-pay, Bachelors, Separated, Exec-managerial, Husband, Amer-Indian-Eskimo, Male, Jamaica,50K+
15.01179053,366899.53672,29192.173323,1461.6284112896,46.22703,10.3725, Never-worked, 5th-6th, Never-married, Other-service, Wife, Black, Female, Poland,50K+
56.31645232,259872.72282,4499.569622,732.8269986623,65.24392,15.90374, Self-emp-not-inc, Prof-school, Separated, Craft-repair, Other-relative, Black, Female, Outlying-US(Guam-USVI-etc),50K+
