age,fnlwgt,capital-gain,capital-loss,hours-per-week,education-num,workclass,education,marital-status,occupation,relationship,race,sex,native-country,class
72.80344971,407187.49791,23372.210988,839.3567806085,20.96534,8.37899, Never-worked, 11th, Never-married, Other-service, Not-in-family, Amer-Indian-Eskimo, Male, Greece,50K+
59.91609412,35643.64865,495.537865,925.9944939449,49.90388,11.00987, ?, Prof-school, Married-AF-spouse, Tech-support, Own-child, White, Female, Mexico,50K+
46.30406676,73942.61027,18509.372084,175.7295732644,62.9869,11.88719, Without-pay, Masters, Married-AF-spouse, Adm-clerical, Wife, Black, Female, El-Salvador,50K+
32.21617842,264936.28613,26722.426192,1092.1841529757,49.90998,10.60222, Private, 12th, Married-civ-spouse, Armed-Forces, Not-in-family, Amer-Indian-Eskimo, Male, Outlying-US(Guam-USVI-etc),50K+
33.08427221,117244.39051,26889.391225,0.0054957275,0.50684,11.55059, Local-gov, Bachelors, Widowed, Armed-Forces, Not-in-family, Amer-Indian-Eskimo, Male, Jamaica,50K+
9.93388295,431316.40259,29389.245373,743.0293105339,27.80299,13.37622, Private, 7th-8th, Married-spouse-absent, Craft-repair, Not-in-family, Amer-Indian-Eskimo, Female, Cambodia,50K+
30.04079881,217.71783,23327.998612,1384.4269285021,0.50684,14.72898, ?, 9th, Married-civ-spouse, Priv-house-serv, Wife, Other, Male, Dominican-Republic,50K+
60.79605256,71306.50461,20962.607832,794.1555639228,5.11478,12.8175, Without-pay, HS-grad, Separated, Craft-repair, Not-in-family, Black, Female, Hong,50K+
39.81376732,191094.83336,24856.939068,1488.0174024842,0.50684,11.39708, Never-worked, 5th-6th, Married-civ-spouse, Farming-fishing, Unmarried, Black, Male, Greece,50K+
61.37218602,306360.6925,26648.950745,1057.5415966926,58.00117,9.04928, Private, Bachelors, Married-civ-spouse, Machine-op-inspct, Unmarried, Amer-Indian-Eskimo, Female, Portugal,50K+
62.71792263,224322.29289,21394.173944,1501.1490560323,59.00623,18.50895, Self-emp-inc, Prof-school, Divorced, Exec-managerial, Other-relative, Amer-Indian-Eskimo, Female, Trinadad&Tobago,50K+
64.22431976,380882.96865,10840.821228,1543.0915523304,5.12831,5.48992, State-gov, Doctorate, Widowed, ?, Husband, White, Female, Cambodia,50K+
59.99337887,162278.73539,9438.40977,470.5027174502,1.06242,7.54878, Self-emp-inc, Some-college, Married-civ-spouse, Transport-moving, Husband, Amer-Indian-Eskimo, Female, Japan,50K+
0.03904451,217.71783,28932.632722,0.0054957275,50.81171,7.13088, ?, Assoc-voc, Never-married, Exec-managerial, Other-relative, White, Female, Philippines,50K+
18.54969106,217.71783,17252.02459,1497.4367345281,45.39479,6.03411, ?, 1st-4th, Separated, Prof-specialty, Husband, White, Male, China,50K+
80.80895118,200557.58746,3929.815439,1533.1016561084,18.26996,11.7921, ?, Assoc-acdm, Separated, Handlers-cleaners, Other-relative, White, Female, Mexico,50K+
68.87263546,406535.64777,21973.205561,583.6954907738,84.1662,6.19673, Self-emp-not-inc, Doctorate, Never-married, Handlers-cleaners, Unmarried, Amer-Indian-Eskimo, Female, Guatemala,50K+
65.47356091,351607.71214,26451.164594,1244.7900025149,78.31066,7.5246, Local-gov, HS-grad, Divorced, Adm-clerical, Wife, Amer-Indian-Eskimo, Male, Thailand,50K+
48.02389121,259669.42813,28056.784343,1260.3332025997,36.67945,13.79633, Without-pay, 9th, Married-civ-spouse, Armed-Forces, Husband, Asian-Pac-Islander, Female, Haiti,50K+
0.03904451,514560.91024,20022.271446,0.0054957275,20.90481,5.34626, Private, Doctorate, Married-spouse-absent, Exec-managerial, Husband, Black, Male, Scotland,50K+
48.72661949,4684.68576,18001.451391,36.2098029657,65.14879,8.44964, Federal-gov, HS-grad, Never-married, Prof-specialty, Not-in-family, Other, Male, Scotland,50K+
12.1699847,500285.35111,13828.038785,1015.0970106688,68.13,17.83946, Self-emp-inc, Masters, Divorced, Craft-repair, Husband, Amer-Indian-Eskimo, Female, Guatemala,50K+
42.63899953,481971.87992,23943.53856,146.2056023683,5.83572,5.04383, Local-gov, 7th-8th, Divorced, ?, Husband, White, Female, Thailand,50K+
58.14389791,227832.90787,17437.108329,792.7366829053,86.54131,4.88438, Without-pay, Preschool, Married-spouse-absent, Craft-repair, Husband, White, Female, France,50K+
0.03904451,217.71783,17631.120691,1274.0449314883,3.88149,0.54879, Federal-gov, Assoc-acdm, Married-AF-spouse, Craft-repair, Not-in-family, Amer-Indian-Eskimo, Female, Guatemala,50K+
17.32998684,475118.06095,27918.513836,506.8610034974,87.9276,1.27203, Self-emp-not-inc, Bachelors, Separated, Sales, Wife, White, Male, United-States,50K+
58.33608608,105465.60212,12737.329433,1220.359828398,13.22488,0.47538, ?, Prof-school, Widowed, ?, Other-relative, Asian-Pac-Islander, Female, Ecuador,50K+
24.52133193,217.71783,18624.531736,454.0509480852,77.42277,7.25153, Local-gov, Preschool, Married-civ-spouse, Craft-repair, Unmarried, Black, Male, France,50K+
0.12861924,466929.66649,19157.772037,995.1910409333,76.34702,9.27502, Never-worked, 11th, Married-AF-spouse, Armed-Forces, Wife, Other, Male, El-Salvador,50K+
27.71037245,1573.51738,25725.626917,697.6075911781,0.50684,11.08733, Self-emp-inc, Masters, Married-AF-spouse, Exec-managerial, Own-child, White, Female, Cambodia,50K+
53.03087945,124191.57877,27711.868992,1498.963043746,86.57681,9.64033, Federal-gov, 11th, Married-spouse-absent, Armed-Forces, Wife, Black, Male, Honduras,50K+
49.08927153,422748.71821,15554.301457,533.4972470112,6.81442,16.0665, Local-gov, 11th, Separated, Sales, Other-relative, White, Female, Germany,50K+
19.51600697,111532.94421,15940.96009,1111.4799615223,0.50684,14.48073, Never-worked, Doctorate, Married-AF-spouse, Machine-op-inspct, Unmarried, Amer-Indian-Eskimo, Female, United-States,50K+
2.98803616,5534.19084,19486.477082,296.8645006004,89.57339,8.25895, State-gov, Assoc-acdm, Married-civ-spouse, Farming-fishing, Wife, White, Male, Japan,50K+
0.03904451,231612.47643,11927.830894,0.0054957275,21.51004,4.49167, Private, Bachelors, Married-AF-spouse, Adm-clerical, Wife, Black, Female, United-States,50K+
0.03904451,217.71783,20771.393338,478.9436878401,59.78165,0.21031, Never-worked, Bachelors, Married-AF-spouse, Machine-op-inspct, Other-relative, White, Female, Scotland,50K+
60.89595116,158851.69787,18329.69396,658.2612905653,20.57677,8.30282, Self-emp-inc, 12th, Widowed, Protective-serv, Not-in-family, Black, Male, Guatemala,50K+
52.37752317,17014.53452,5517.684896,483.704742201,74.75715,4.21962, State-gov, 1st-4th, Married-civ-spouse, Machine-op-inspct, Wife, White, Male, Taiwan,50K+
21.81032367,469645.55644,20867.543551,754.7967319202,54.25814,15.4567, ?, 12th, Married-civ-spouse, Other-service, Unmarried, Asian-Pac-Islander, Female, Jamaica,50K+
26.78650481,217.71783,22885.729045,0.0054957275,45.16092,7.01933, Private, Preschool, Separated, Craft-repair, Husband, Asian-Pac-Islander, Female, France,50K+
47.42738401,433611.6343,18577.919944,246.7723547722,41.01874,12.25921, ?, 12th, Divorced, Protective-serv, Husband, Black, Female, Jamaica,50K+
46.81215768,211581.8424,16803.210241,827.9786672325,49.22017,7.99674, Self-emp-not-inc, Preschool, Divorced, ?, Wife, Other, Male, Taiwan,50K+
19.05518167,57092.63986,19285.745271,1391.920249615,60.72609,12.0371, ?, Prof-school, Married-civ-spouse, Prof-specialty, Own-child, Amer-Indian-Eskimo, Female, El-Salvador,50K+
29.11491897,99766.79252,28555.075374,269.2651596684,31.31502,13.54267, Without-pay, 5th-6th, Married-spouse-absent, Priv-house-serv, Other-relative, Black, Male, Portugal,50K+
79.65844095,276536.09351,10593.018044,829.10741851,80.99832,2.38803, Private, Assoc-acdm, Separated, Armed-Forces, Husband, Other, Female, China,50K+
19.54168874,348530.73836,10709.048189,1046.8911965358,39.94674,16.84922, Self-emp-not-inc, HS-grad, Widowed, Machine-op-inspct, Unmarried, Asian-Pac-Islander, Male, Mexico,50K+
52.83622632,255396.76738,15961.770181,1465.0810820774,87.99943,5.76387, Never-worked, Doctorate, Married-civ-spouse, Tech-support, Not-in-family, Other, Female, Ireland,50K+
56.37113564,366588.84706,18036.798806,973.806766902,28.54037,3.35876, Never-worked, 5th-6th, Married-AF-spouse, Armed-Forces, Wife, White, Male, Honduras,50K+
10.96011559,528391.85308,26736.813267,1486.3706358069,52.16507,9.23699, Federal-gov, HS-grad, Married-AF-spouse, Handlers-cleaners, Not-in-family, Asian-Pac-Islander, Female, Mexico,50K+
0.03904451,217.71783,27653.137972,0.0054957275,0.50684,8.37359, Private, Bachelors, Never-married, Exec-managerial, Unmarried, White, Male, Mexico,50K+
57.11273886,69880.97283,10497.74548,698.9122595178,10.93031,11.20465, Without-pay, Bachelors, Widowed, Sales, Unmarried, Black, Male, Puerto-Rico,50K+
13.39867234,217.71783,21128.95372,0.0054957275,77.01199,6.70604, Self-emp-not-inc, Assoc-voc, Married-AF-spouse, Priv-house-serv, Husband, White, Male, Ecuador,50K+
72.55058894,401103.86519,28908.082209,521.8799615921,46.64627,11.64715, Private, 7th-8th, Separated, Other-service, Other-relative, Asian-Pac-Islander, Female, Nicaragua,50K+
69.27307506,510939.84391,29373.336634,1354.4070353952,44.36587,7.71946, Private, 5th-6th, Widowed, Priv-house-serv, Other-relative, Black, Male, Mexico,50K+
62.69847457,454494.01241,13605.129146,926.8036268263,56.20818,9.59366, State-gov, Masters, Married-AF-spouse, Armed-Forces, Other-relative, White, Male, Japan,50K+
0.03904451,217.71783,24854.757428,605.6657187704,75.7128,0.21031, Local-gov, Assoc-voc, Married-civ-spouse, Other-service, Not-in-family, Other, Male, Jamaica,50K+
72.89880478,480627.3863,19761.926614,126.2519360529,73.46152,8.73766, Self-emp-inc, Some-college, Married-AF-spouse, Priv-house-serv, Other-relative, Other, Male, Taiwan,50K+
48.06530945,40888.03222,10281.687333,1000.1569890684,61.02908,8.63293, Local-gov, Doctorate, Widowed, Armed-Forces, Wife, Asian-Pac-Islander, Female, Greece,50K+
38.97485122,168572.05465,17298.548509,1106.1821879979,22.44029,8.63485, Federal-gov, HS-grad, Married-AF-spouse, Priv-house-serv, Other-relative, Black, Female, India,50K+
60.43525411,160344.1107,25976.33935,327.2817945126,21.64794,5.20813, ?, Prof-school, Married-civ-spouse, Machine-op-inspct, Not-in-family, Other, Female, Peru,50K+
74.46660906,172726.6363,5747.786466,466.5615170996,68.27792,14.09913, Private, 12th, Never-married, Protective-serv, Husband, Black, Female, Thailand,50K+
10.52088207,327308.92416,27112.650135,725.4628626346,0.50684,11.13797, State-gov, Doctorate, Married-spouse-absent, Adm-clerical, Wife, White, Male, Cambodia,50K+
39.09715724,88070.93685,22345.794105,728.0363044593,8.15038,12.53921, Never-worked, 7th-8th, Married-AF-spouse, Prof-specialty, Other-relative, Asian-Pac-Islander, Male, Outlying-US(Guam-USVI-etc),50K+
18.27743735,542723.71856,5.621231,0.0054957275,83.77961,18.15358, Never-worked, Doctorate, Married-AF-spouse, Exec-managerial, Unmarried, White, Male, Ireland,50K+
55.51447256,409286.84945,1709.268017,1368.8561771904,39.4361,10.65918, Private, Assoc-voc, Married-AF-spouse, Tech-support, Unmarried, Black, Male, Italy,50K+
65.73446644,112779.84981,7449.273877,79.3675599794,32.36794,17.11853, Self-emp-not-inc, Some-college, Married-spouse-absent, Machine-op-inspct, Husband, Black, Male, Ireland,50K+
42.81637077,200363.8685,27732.994075,334.7698152243,50.94854,9.1393, State-gov, 10th, Separated, Transport-moving, Other-relative, White, Male, Hong,50K+
75.77895405,456259.14696,8245.339609,1114.4113524098,4.6127,13.40777, Never-worked, Masters, Never-married, Tech-support, Not-in-family, White, Male, England,50K+
37.42785134,233187.68084,18507.376053,916.5537030898,20.10969,4.68128, Federal-gov, Masters, Separated, Armed-Forces, Other-relative, White, Female, Jamaica,50K+
9.92500325,266874.25473,5234.022832,548.8237395732,51.04917,9.53526, Self-emp-not-inc, Doctorate, Married-civ-spouse, Protective-serv, Wife, Amer-Indian-Eskimo, Female, Ireland,50K+
74.32918766,540441.924,2738.730855,571.0245703926,53.76473,12.09268, Local-gov, 11th, Married-civ-spouse, Prof-specialty, Wife, Other, Male, Thailand,50K+
58.41357342,457086.14455,10279.143981,1176.9444580753,13.64854,9.79445, Never-worked, Masters, Married-civ-spouse, Other-service, Not-in-family, Black, Female, Italy,50K+
71.35487334,280199.46233,29130.12346,875.9401696462,15.13639,13.44839, Private, 10th, Separated, Armed-Forces, Other-relative, White, Male, Portugal,50K+
38.66160986,487550.78194,18117.324611,475.6790322343,62.93943,0.91352, Private, Assoc-voc, Married-civ-spouse, ?, Wife, Asian-Pac-Islander, Female, Honduras,50K+
73.95321938,433394.25446,13607.018643,486.2336021242,83.40351,8.69389, Without-pay, HS-grad, Divorced, Craft-repair, Not-in-family, Black, Female, England,50K+
59.37832174,76593.61999,9087.885642,289.3043142583,18.94488,11.95169, ?, Doctorate, Married-spouse-absent, Prof-specialty, Own-child, Black, Male, Hong,50K+
54.80161893,65791.85656,14516.577352,414.4673481231,57.17928,8.51232, Without-pay, Assoc-voc, Married-civ-spouse, Sales, Unmarried, Black, Female, Mexico,50K+
53.22252758,344091.31144,5424.951779,1133.2564525031,54.11974,13.71148, Without-pay, Doctorate, Married-AF-spouse, ?, Husband, Asian-Pac-Islander, Female, United-States,50K+
13.53920156,370238.60116,6093.689835,897.5960768813,84.02237,8.64875, ?, 10th, Married-AF-spouse, Armed-Forces, Not-in-family, Black, Female, Germany,50K+
41.35870891,380872.39842,9796.324109,1023.2099165725,69.21025,7.42047, Local-gov, 10th, Separated, Handlers-cleaners, Not-in-family, Black, Male, Laos,50K+
19.19105836,217.71783,19904.961592,0.0054957275,0.50684,9.68085, ?, Some-college, Married-civ-spouse, Tech-support, Not-in-family, White, Male, England,50K+
70.05153327,417518.11461,18633.884314,1234.326933553,32.31656,10.74606, State-gov, Assoc-acdm, Separated, Exec-managerial, Wife, White, Female, South,50K+
28.56491162,407509.20225,25187.436437,962.4512625957,62.22564,13.24883, ?, Assoc-voc, Divorced, Exec-managerial, Unmarried, White, Male, Dominican-Republic,50K+
24.77352559,97373.64133,12375.338455,147.9587341657,59.2124,9.23265, Never-worked, Some-college, Separated, Craft-repair, Other-relative, Black, Male, China,50K+
82.16832903,66235.14753,5671.144449,46.4564450533,67.79207,10.59065, Never-worked, Masters, Divorced, Handlers-cleaners, Husband, Black, Female, Puerto-Rico,50K+
16.75894907,187828.35192,10898.147236,0.0054957275,0.50684,0.21031, Never-worked, Doctorate, Married-AF-spouse, Prof-specialty, Own-child, Asian-Pac-Islander, Male, Hong,50K+
69.15042476,185287.07704,25964.641635,387.6410234509,87.74287,10.90212, ?, Masters, Never-married, Exec-managerial, Other-relative, Amer-Indian-Eskimo, Male, Outlying-US(Guam-USVI-etc),50K+
34.05298557,217.71783,21909.786601,140.4359823974,29.11957,8.36511, Self-emp-inc, Prof-school, Divorced, Armed-Forces, Not-in-family, Amer-Indian-Eskimo, Female, Iran,50K+
24.28977373,490882.74174,11441.224113,76.199255568,56.88717,12.42241, Never-worked, 9th, Divorced, Armed-Forces, Not-in-family, Asian-Pac-Islander, Male, India,50K+
28.49664348,235206.17216,19977.068123,1422.7939800479,74.17409,7.34615, State-gov, 1st-4th, Widowed, Machine-op-inspct, Unmarried, Other, Male, Taiwan,50K+
63.42232491,172576.13528,26200.514821,49.4691160416,53.40011,6.30405, Private, Bachelors, Divorced, Other-service, Other-relative, White, Male, France,50K+
50.76627729,183938.71153,24685.089976,527.3337620768,0.87221,16.79263, Without-pay, HS-grad, Married-AF-spouse, ?, Husband, Amer-Indian-Eskimo, Female, Hong,50K+
20.20034116,246404.08435,26920.538499,181.171863544,21.98109,9.28413, Self-emp-not-inc, 5th-6th, Married-AF-spouse, Transport-moving, Wife, Asian-Pac-Islander, Female, Ecuador,50K+
56.13233065,545442.17712,13603.707596,1164.7339178008,42.23789,9.46726, Local-gov, Doctorate, Separated, Other-service, Husband, Asian-Pac-Islander, Female, Trinadad&Tobago,50K+
2.0162657,217.71783,23434.714774,0.0054957275,13.33895,11.18654, Self-emp-not-inc, 7th-8th, Married-civ-spouse, Machine-op-inspct, Own-child, Asian-Pac-Islander, Male, Scotland,50K+
74.05993018,187331.33802,10912.758478,111.8030849241,71.22901,16.81398, Local-gov, Assoc-voc, Married-civ-spouse, Farming-fishing, Husband, White, Female, Hong,50K+
0.03904451,493601.96873,25862.735999,135.0442820957,20.09009,10.83283, Local-gov, Doctorate, Married-AF-spouse, ?, Not-in-family, Black, Male, Scotland,50K+
16.07389952,523086.99037,5.621231,1099.5022402622,59.32476,9.42148, Never-worked, Doctorate, Married-civ-spouse, ?, Husband, White, Female, Italy,50K+
0.03904451,217.71783,26398.764436,182.8534282939,69.73609,14.24143, State-gov, 10th, Never-married, Tech-support, Wife, Other, Female, Honduras,50K+
0.03904451,519.84664,22680.294931,1271.1559895004,55.1489,9.88906, Self-emp-inc, Assoc-acdm, Widowed, Armed-Forces, Not-in-family, White, Female, South,50K+
18.20280054,497068.38581,16933.207804,64.3004658026,26.26798,9.00586, Self-emp-not-inc, 12th, Married-AF-spouse, Tech-support, Not-in-family, White, Female, Mexico,50K+
54.61498556,171820.1629,5815.887894,1212.2041571711,35.21126,8.51758, Private, 10th, Married-AF-spouse, Craft-repair, Husband, Asian-Pac-Islander, Male, Trinadad&Tobago,50K+
7.38084855,195937.41506,20906.918985,1404.9839098693,85.7813,7.44673, Self-emp-inc, Doctorate, Married-AF-spouse, Prof-specialty, Wife, White, Female, China,50K+
26.20254795,198803.48976,26358.277528,501.6082139314,71.14065,14.23594, Without-pay, Doctorate, Married-AF-spouse, Handlers-cleaners, Wife, White, Male, Greece,50K+
76.73810769,366918.54678,904.88549,1185.0407255525,33.34466,14.36916, Self-emp-inc, Doctorate, Divorced, Sales, Husband, White, Female, Greece,50K+
67.26972693,418702.45765,25633.33047,269.4409128503,73.79563,14.1407, Federal-gov, HS-grad, Never-married, Transport-moving, Husband, Amer-Indian-Eskimo, Female, France,50K+
23.08176064,370613.52376,27213.205374,1095.7966491558,47.13096,7.0541, State-gov, Assoc-voc, Married-civ-spouse, ?, Husband, Asian-Pac-Islander, Male, Thailand,50K+
15.61672357,217.71783,16310.434247,0.0054957275,51.75873,8.94907, ?, 10th, Married-AF-spouse, Handlers-cleaners, Unmarried, White, Male, Outlying-US(Guam-USVI-etc),50K+
0.03904451,272123.11253,7255.423903,0.0054957275,72.53809,7.56934, ?, Assoc-acdm, Divorced, Priv-house-serv, Not-in-family, Asian-Pac-Islander, Male, Germany,50K+
74.57656319,190692.16578,21684.06964,909.2906354835,38.63405,11.15192, Without-pay, 9th, Married-spouse-absent, Prof-specialty, Own-child, White, Male, Philippines,50K+
40.41419823,26492.23438,10576.27807,60.6127934452,0.50684,12.30709, Private, 9th, Married-civ-spouse, Prof-specialty, Husband, Amer-Indian-Eskimo, Female, Outlying-US(Guam-USVI-etc),50K+
80.26854351,483504.89989,27894.70093,1433.8465641524,16.27597,4.15468, Self-emp-not-inc, 7th-8th, Divorced, Prof-specialty, Unmarried, Asian-Pac-Islander, Male, Italy,50K+
78.51123636,65831.64006,17740.707083,732.325458472,54.2942,5.76552, Never-worked, 1st-4th, Married-spouse-absent, Prof-specialty, Own-child, White, Male, United-States,50K+
44.99436806,8791.78113,24348.89545,441.0151448674,17.24075,9.09491, Federal-gov, Prof-school, Divorced, Tech-support, Unmarried, Black, Female, India,50K+
0.03904451,322850.13573,20871.9168,1180.5719316242,0.50684,10.06819, State-gov, Prof-school, Married-spouse-absent, Tech-support, Other-relative, Asian-Pac-Islander, Male, Philippines,50K+
53.14565594,187726.55952,6100.006574,632.4200635229,19.23459,13.70268, Self-emp-inc, Doctorate, Separated, Protective-serv, Not-in-family, Black, Female, Honduras,50K+
50.07469118,426809.45176,17608.294747,831.0182082257,81.75628,14.18428, Federal-gov, Doctorate, Separated, Protective-serv, Wife, Amer-Indian-Eskimo, Female, Outlying-US(Guam-USVI-etc),50K+
0.03904451,217.71783,17606.007455,308.7229101415,86.86289,12.71365, Without-pay, 11th, Married-civ-spouse, Prof-specialty, Own-child, Asian-Pac-Islander, Female, Cuba,50K+
71.08425742,28689.98894,24994.891371,1283.4686863123,23.13898,13.57795, Local-gov, 11th, Married-civ-spouse, Sales, Other-relative, Amer-Indian-Eskimo, Male, Dominican-Republic,50K+
71.680799,388464.06337,16564.768098,665.3558559024,5.45604,17.93652, Self-emp-inc, Masters, Divorced, Transport-moving, Husband, Asian-Pac-Islander, Male, Guatemala,50K+
0.03904451,225907.2245,27351.360844,0.0054957275,67.12946,14.52548, Local-gov, Preschool, Widowed, Other-service, Unmarried, White, Male, Germany,50K+
5.42997379,217.71783,23613.323968,876.7614168251,48.45591,11.47029, Private, Assoc-voc, Married-AF-spouse, Machine-op-inspct, Wife, White, Female, Cuba,50K+
59.9212269,100635.33654,16821.294219,158.9185897482,30.19633,6.94426, Never-worked, Some-college, Married-AF-spouse, Machine-op-inspct, Wife, White, Female, Scotland,50K+
0.03904451,451037.55808,11005.837487,97.2361166683,81.12762,8.57286, ?, 12th, Married-civ-spouse, Tech-support, Wife, Black, Female, China,50K+
76.09245052,455296.07632,3023.580825,1239.4210784429,65.49404,9.70404, Self-emp-not-inc, Bachelors, Separated, Handlers-cleaners, Husband, Black, Female, Taiwan,50K+
23.9025032,155266.70682,24975.970812,102.5216192324,38.67016,10.60937, Without-pay, 9th, Married-spouse-absent, ?, Husband, Asian-Pac-Islander, Male, Jamaica,50K+
51.24411239,126518.28781,20846.709661,861.4857127435,71.33894,9.14283, Self-emp-inc, 7th-8th, Married-AF-spouse, Handlers-cleaners, Husband, White, Female, Cambodia,50K+
82.33568294,297940.80386,23077.557327,51.0492076499,9.87175,11.26263, Federal-gov, Bachelors, Married-civ-spouse, ?, Own-child, Black, Female, Greece,50K+
56.27091664,246409.02308,21078.059711,1159.9742004437,62.68747,9.16157, Self-emp-inc, Assoc-acdm, Widowed, Handlers-cleaners, Other-relative, Other, Female, Iran,50K+
0.03904451,217.71783,20184.243642,0.0054957275,4.78605,6.53262, Without-pay, Doctorate, Separated, Craft-repair, Wife, Black, Male, China,50K+
34.41401512,413712.37075,5395.844452,614.3366415995,84.68965,9.42377, Private, Bachelors, Separated, Priv-house-serv, Not-in-family, Black, Male, India,50K+
0.03904451,217.71783,26558.724269,0.0054957275,0.50684,14.12853, Local-gov, Assoc-voc, Separated, Sales, Wife, White, Male, Puerto-Rico,50K+
0.03904451,217.71783,22764.419345,17.334978475,15.38919,6.51976, Self-emp-not-inc, Assoc-acdm, Divorced, Sales, Other-relative, Asian-Pac-Islander, Female, Vietnam,50K+
42.56156976,440926.74915,24871.715594,300.1693946372,50.10901,9.9036, Private, 9th, Separated, Sales, Husband, Amer-Indian-Eskimo, Male, France,50K+
29.04027883,89359.34741,19591.81068,1066.8207724062,31.532,7.28602, ?, Prof-school, Widowed, Protective-serv, Other-relative, Asian-Pac-Islander, Female, Nicaragua,50K+
56.34540285,6735.21525,20775.509031,475.2027229681,14.39736,5.26763, Local-gov, 11th, Never-married, Handlers-cleaners, Unmarried, White, Male, France,50K+
16.45915987,217.71783,19501.743649,111.9872725235,39.76123,17.07506, Local-gov, Doctorate, Separated, Other-service, Other-relative, Other, Female, Hong,50K+
34.95603874,161618.57548,10992.207728,209.1969458202,81.96565,9.9456, Self-emp-not-inc, Assoc-voc, Divorced, Other-service, Wife, Other, Female, Outlying-US(Guam-USVI-etc),50K+
64.04254476,58378.04087,997.80701,1524.8464607137,79.69959,10.83018, State-gov, 9th, Married-spouse-absent, Protective-serv, Unmarried, Black, Male, Cambodia,50K+
34.45892437,217.71783,17354.446229,925.1695262891,0.50684,10.55468, Local-gov, Masters, Separated, Craft-repair, Own-child, Black, Male, Peru,50K+
82.7889795,67606.80462,11705.577862,1142.8142558083,84.86844,7.90716, Never-worked, Some-college, Separated, ?, Not-in-family, Black, Male, Laos,50K+
72.09013489,478797.28933,6482.812432,1362.1819624261,44.53058,8.25844, Local-gov, Prof-school, Divorced, Adm-clerical, Not-in-family, Other, Female, Hong,50K+
8.84027541,329408.88372,19433.99057,326.0960951307,88.76088,14.49235, Self-emp-not-inc, Some-college, Married-AF-spouse, Transport-moving, Not-in-family, White, Male, Thailand,50K+
0.03904451,377785.7534,21282.837612,678.497844774,0.50684,7.09192, Federal-gov, Doctorate, Separated, Machine-op-inspct, Not-in-family, Asian-Pac-Islander, Male, Scotland,50K+
48.70800109,162161.81281,5.621231,0.0054957275,67.54926,17.26215, Self-emp-not-inc, Masters, Separated, Prof-specialty, Wife, White, Male, Trinadad&Tobago,50K+
25.46897076,433691.69757,28159.042884,148.3389788691,60.38274,14.29568, ?, 11th, Married-AF-spouse, Machine-op-inspct, Unmarried, Asian-Pac-Islander, Female, Honduras,50K+
47.56214247,449352.54111,26804.427521,0.0054957275,4.78206,13.4766, Local-gov, Doctorate, Married-AF-spouse, Priv-house-serv, Not-in-family, Asian-Pac-Islander, Male, Trinadad&Tobago,50K+
67.34857382,113751.98175,24275.859976,428.0045029447,9.98319,14.45611, State-gov, Masters, Divorced, Farming-fishing, Not-in-family, Asian-Pac-Islander, Female, Outlying-US(Guam-USVI-etc),50K+
49.60398525,391699.63302,12128.780514,476.0594104599,63.41605,5.58509, Never-worked, 9th, Never-married, Prof-specialty, Husband, Other, Male, Trinadad&Tobago,50K+
13.30989389,360522.24676,16604.823308,143.3428061751,82.86726,18.64779, Federal-gov, 1st-4th, Separated, Handlers-cleaners, Unmarried, White, Female, France,50K+
30.5443177,465362.93864,21925.366857,1122.2561220641,29.20121,10.95737, Local-gov, Prof-school, Married-AF-spouse, Transport-moving, Husband, Asian-Pac-Islander, Female, Scotland,50K+
17.73601356,217.71783,17930.924876,1393.6917703623,0.50684,10.62365, State-gov, Bachelors, Divorced, Machine-op-inspct, Wife, Amer-Indian-Eskimo, Male, ?,50K+
29.96889216,230427.78107,22155.632718,780.1499104376,63.11448,10.23639, Without-pay, Bachelors, Divorced, Armed-Forces, Husband, Asian-Pac-Islander, Female, Guatemala,50K+
38.9293886,515963.73566,16476.968672,1528.4180991538,0.67782,14.33525, State-gov, Masters, Divorced, Craft-repair, Own-child, Black, Male, Ireland,50K+
19.44592896,179818.33241,6709.249669,829.1691700528,88.09814,11.53104, Federal-gov, 11th, Married-civ-spouse, Handlers-cleaners, Wife, Black, Male, France,50K+
