age,fnlwgt,capital-gain,capital-loss,hours-per-week,education-num,workclass,education,marital-status,occupation,relationship,race,sex,native-country,class
27.290974,201546.0196,17416.0379,1026.7951224,55.887182,9.3532726, ?, Prof-school, Never-married, Transport-moving, Husband, Asian-Pac-Islander, Male, Honduras,50K+
64.5956058,429260.6055,24018.0907,400.2933849,73.849931,13.4529916, Self-emp-inc, Bachelors, Married-spouse-absent, Machine-op-inspct, Other-relative, White, Female, South,50K+
39.4639599,90844.6831,11628.6543,677.3951103,41.96544,9.3968686, ?, 12th, Married-civ-spouse, Tech-support, Own-child, White, Male, Peru,50K+
58.2222334,210399.6844,23220.3524,945.4760988,35.433566,7.2597666, Self-emp-not-inc, 10th, Widowed, Other-service, Unmarried, Other, Female, Mexico,50K+
37.6478796,481638.7871,9667.8742,958.1368738,32.731275,12.9083628, ?, 10th, Divorced, ?, Not-in-family, Black, Male, Japan,50K+
30.7223938,31934.1882,11642.1327,1.4293151,7.026468,8.228817, ?, Some-college, Never-married, Craft-repair, Husband, Asian-Pac-Islander, Male, United-States,50K+
46.2267161,131721.3524,23482.3268,1304.7806428,40.594647,12.360143, ?, 7th-8th, Married-AF-spouse, Handlers-cleaners, Not-in-family, White, Female, Jamaica,50K+
54.205017,418137.4539,21485.8059,1344.3119764,27.579852,6.9355727, Private, 10th, Married-civ-spouse, Protective-serv, Other-relative, Other, Male, Peru,50K+
68.5326181,452101.552,12153.0191,765.9976089,22.374667,11.3008323, ?, 11th, Widowed, Other-service, Wife, White, Male, Jamaica,50K+
34.8459319,433139.4322,12007.0473,1163.8810255,44.662448,9.0767121, State-gov, 11th, Divorced, Adm-clerical, Husband, Other, Male, United-States,50K+
21.0318061,5904.2892,24946.1326,1343.8419942,31.390647,10.5095104, ?, Masters, Divorced, Prof-specialty, Wife, Other, Male, Trinadad&Tobago,50K+
53.9054969,208838.6016,24533.4496,965.2259188,60.017172,11.8354602, Federal-gov, 1st-4th, Divorced, Sales, Other-relative, Asian-Pac-Islander, Male, France,50K+
64.9431377,393753.4086,11192.1839,350.9345866,62.572566,15.1057054, Self-emp-not-inc, Some-college, Never-married, Prof-specialty, Unmarried, White, Female, Philippines,50K+
50.9124846,187103.5978,24377.8938,1283.508582,71.671877,12.2945664, Self-emp-not-inc, Assoc-voc, Separated, Craft-repair, Own-child, White, Male, ?,50K+
37.0629688,460746.7298,1924.9883,1270.5490035,24.322717,17.1737718, Private, 11th, Married-AF-spouse, Craft-repair, Own-child, White, Male, Cuba,50K+
58.4406068,214993.3734,17887.0465,1344.7984729,50.470677,11.3093716, Self-emp-inc, 1st-4th, Divorced, Adm-clerical, Husband, White, Male, France,50K+
62.1932643,456265.6482,16874.8379,342.7819933,19.05151,10.6781097, Private, 5th-6th, Married-civ-spouse, Adm-clerical, Other-relative, Asian-Pac-Islander, Female, Ireland,50K+
17.6315125,211707.0041,21859.7775,309.1603064,53.045345,11.3231868, Federal-gov, Doctorate, Married-civ-spouse, ?, Husband, White, Male, Guatemala,50K+
49.6590792,86420.1449,4378.2109,1372.8302329,39.47389,8.3628149, State-gov, HS-grad, Married-AF-spouse, Adm-clerical, Wife, Amer-Indian-Eskimo, Male, United-States,50K+
